RP Candy Airheads Soft Filled Bites 9 OZ,1/9 OZ/CS,"sugar, glucose syrup, high fructose corn syrup, corn starch, food starch modified, moidifed potato, contains less than 2% of: malic acid, dextrose, citric acid, palm oil, lactic acid, gelatin, artificial flavors, hydrogenated palm oil, sorbitol syrup, glycerin, salt, fumaric acid, potassium citrate, yellow 6, red 40, blue 1, yellow 5    peanut and tree nut free",-1.043
Bread Challah Sliced FZ,3/48OZ/CS,"enriched unbleached flour (wheat flour, malted barley flour, reduced iron, thiamine mononitrate (vitamin b1), riboflavin (vitamin b2), niacin (vitamin b3), folic acid), water, salt, yeast, canola oil, sugar, calcium stearoyl lactylate, malt powder (dried corn syrup, barley malt extract), datem, yellow corn flour, soybean oil, potassium iodate, calcium propionate (a preservative), spice oils (tumeric and annatto), ascorbic acid, l-cysteine hydrochloride, soy lecithin. ",-1.042
Cookie Dough EB White Choco Macadamia FZ,204/1.25 OZ/CS,"enriched wheat flour (wheat flour, niacin, reduced iron, thiamine mononitrate,  riboflavin, folic acid, ascorbic acid added as a dough conditioner), sugar, candy coated milk chocolate (milk chocolate [sugar, cocoa butter, chocolate liquor, whole and nonfat milk powders, soy lecithin and/or sunflower lecithin and/or polycycerol polyricinolate {an emulsifier}, salt, natural and artificial flavor], sugar, corn syrup, dextrin, modified corn starch, artificial coloring [titanium dioxide, yellow 5, yellow 5 lake, red 40, red 40 lake, blue 1, blue 1 lake, yellow 6 lake, blue 2 lake], gum arabic, carnauba wax, corn starch), margarine (palm oil, palm kernel oil, canola oil, water, salt, whey powder [milk], vegetable monoglycerides, citric acid, natural flavor, vitamin a palmitate, vitamin d3), eggs, invert sugar, molasses, water, baking soda, natural flavor, salt.  ",-1.041
Cookie Dough EB Monster FZ,204/1.25 OZ/CS,"enriched wheat flour (wheat flour, niacin, reduced iron, thiamine mononitrate, riboflavin, folic acid, ascorbic acid added as a dough conditioner), sugar, candy coated milk chocolate (milk chocolate [sugar, cocoa butter, chocolate liquor, whole and nonfat milk powders, soy lecithin and/or sunflower lecithin and/or polycycerol polyricinolate {an emulsifier}, salt, natural and artificial flavor], sugar, corn syrup, dextrin, modified corn starch, artificial coloring [titanium dioxide, yellow 5, yellow 5 lake, red 40, red 40 lake, blue 1, blue 1 lake, yellow 6 lake, blue 2 lake], gum arabic, carnauba wax, corn starch), margarine (palm oil, palm kernel oil, canola oil, water, salt, whey powder [milk], vegetable monoglycerides, citric acid, natural flavor, vitamin a palmitate, vitamin d3), eggs,invert sugar, molasses, water, baking soda, natural flavor, salt.",-1.041
Cookie Dough EB Monster 2OZ FZ,128/2OZ/CS,"enriched wheat flour (wheat flour, niacin, reduced iron, thiamine mononitrate, riboflavin, folic acid, ascorbic acid added as a dough conditioner), sugar, candy coated milk chocolate (milk chocolate [sugar, cocoa butter, chocolate liquor, whole and nonfat milk powders, soy lecithin and/or sunflower lecithin and/or polycycerol polyricinolate {an emulsifier}, salt, natural and artificial flavor], sugar, corn syrup, dextrin, modified corn starch, artificial coloring [titanium dioxide, yellow 5, yellow 5 lake, red 40, red 40 lake, blue 1, blue 1 lake, yellow 6 lake, blue 2 lake], gum arabic, carnauba wax, corn starch), margarine (palm oil, palm kernel oil, canola oil, water, salt, whey powder [milk], vegetable monoglycerides, citric acid, natural flavor, vitamin a palmitate, vitamin d3), eggs,invert sugar, molasses, water, baking soda, natural flavor, salt.",-1.041
RP Bar Nature Valley S&S Granola Peanut,16/1.2 OZ/CS,"roasted peanuts, corn syrup, sugar, whole grain oats, dark chocolate chunks (sugar, chocolate liquor, cocoa butter, soy lecithin, natural flavor), rice flour, palm kernel oil, almonds, fructose, cocoa, vegetable glycerin, canola oil, salt, soy lecithin, corn starch, barley malt extract, milk, baking soda, natural flavor, vitamin e (mixed tocopherols) added to retain freshness.    contains: peanut, almond, soy and milk",-1.038
RP York St Salad Greek,1 CT,"ingredients: rustic spring mix, champagne vinaigrette (soybean oil and/or canola oil, water, white wine, white wine vinegar, inverted sugar, salt, contains less than 2% of: calcium disodium edta (to protect flavor), dehydrated chives, dehydrated garlic, dehydrated onion, monosodium glutamate, natural flavors, spices (contains mustard), xanthan gum.), feta cheese (pasteurized milk, salt, cheese cultures, enzymes), pepperoncini (peppers, water, salt, acetic acid, citric acid, sodium benzoate, sodium metabisulfate, yellow #5), cucumber, red onion, kalamata olives, water, red wine vinegar, salt, extra virgin olive oil, grape tomato",-1.029
RP Hostess Twinkies,6/2 CT/CS,"sugar, water, enriched flour (bleached wheat flour, malted barley flour, niacin, ferrous sulfate or reduced iron, thiamine mononitrate, riboflavin, folic acid), high fructose corn syrup, tallow, dextrose, egg, contains 2% or less: soybean oil, corn starch, modified cornstarch, hydrogenated tallow, whey, glycerin, salt, sodium acid pyrophosphate, baking soda, enzymes, sorbic acid and potassium sorbate (to retain freshness), cottonseed oil, mono and diglycerides, cellulose gum, sodium stearoyl lactylate, soy lecithin, xanthan gum, polysorbate 60, monocalcium phosphate, natural and artificial flavor, yellow 5, red 40.  contains egg, milk, soy, wheat",-1.026
RP Ice Cream Blue Bun Sand Strawberry FZ,24/6 OZ/CS,"frozen dairy dessert (skim milk, whey, sugar, strawberry ribbon (sugar, strawberries, water, pectin, natural flavors, strawberry juice concentrate, cherry juice concentrate, red 40, blue 1, phosphoric acid, citric acid, malic acid, calcium chloride), corn syrup, buttermilk, strawberry puree, cream, coconut oil, milk, contains 2% or less of natural flavors, citric acid, carob bean gum, cellulose gel, cellulose gum, guar gum, tara gum, carrageenan, xanthan gum, mono and diglycerides, beet extract for color}. wafers (wheat flour, sugar, soybean oil, palm oil, high fructose corn syrup, corn syrup, food starch-modified, soy lecithin, salt, natural and artificial flavor, baking soda). contains milk, soy, wheat.",-1.022
Chip Tostito Tortilla,8/16 OZ/CS,"whole corn, corn, vegetable oil (corn, canola, and/or sunflower oil), and salt. ",-1.0
Dressing PM Raspberry Wild,4/GAL/CS,"soybean oil, water, sugar, red wine vinegar, raspberry flavored juice concentrate blend (apple, pear, raspberry, and elderberry juice concentrates, citric acid, natural flavor), salt, distilled vinegar, lemon juice concentrate, xanthan gum, spices, dried lemon peel, dried chive, natural flavor, calcium disodium edta (to protect quality). ",-1.0
Dressing Blue Cheese PM Packet,60/1.5 OZ/CS,"soybean oil, water, blue cheese (pasteurized milk, cheese cultures, salt, enzymes), sugar, distilled vinegar, egg yolks, salt, contains less than 2% of lactic acid, natural flavor (includes milk), xanthan gum, propylene glycol alginate, garlic*, disodium inosinate & disodium guanylate, potassium sorbate (a preservative), mustard flour, calcium disodium edta added to protect flavor. *dehydrated",-1.0
Dressing Golden Italian Packet,60/1.5 OZ/CS,"soybean oil, distilled vinegar, water, sugar, salt, contains 2% or less of garlic, xanthan gum, onion, red bell pepper, spices lemon juice concentrate, natural flavor, beta carotene (color), oleoresin paprika (color). ",-1.0
Danish Margherita,36CT/CS,"unbleached enriched flour (wheat flour, niacin, reduced iron, thiamin mononitrate, riboflavin, folic acid), tomato and cheese filling [diced tomatoes (tomatoes, citric acid), part skim mozzarella cheese ((partly skimmed milk, bacterial culture, salt, calcium chloride, microbial enzyme), cellulose), tomato sauce (modified corn starch, tomato powder, paprika powder, salt, sugar, xanthan gum, onion powder, garlic powder, spices, paprika extract, citric acid, spices extractive, onion oil, garlic oil), parmesan cheese (cultured milk, salt, enzymes, powdered cellulose), modified corn starch, spices], butter (cream), water, skim mozzarella cheese ((partly skimmed milk, bacterial culture, salt, calcium chloride, microbial enzyme), cellulose), sugar, yeast, eggs, salt, wheat gluten, food enzymes (xylanase, amylase), ascorbic acid, dried eggs, skim milk, soy flour",-1.0
Dressing Mayonnaise,4/GAL/CS,"soybeal oil, water, whole egg, distilled vinegar, egg yolks, contains less than 2% of salt, sugar, lemon juice, calcium disodium edta added to protect flavor, natural flavor, oleoresin paprika (color). ",-1.0
Dressing Vinaigrette Balsamic,4/1 GAL/CS,"soybean oil, water, balsamic vinegar (wine vinegar, grape concentrate, caramel color, natural flavor, sulfites), sugar, distilled vinegar, contains less than 2% of salt, caramel color, spice, xanthan gum, garlic*, onion*, sodium benzoate and potassium sorbate (as preservatives), propylene glycol alginate, calcium disodium edta added to protect flavor. *dehydrated. ",-1.0
Dressing Ranch Marzetti 1 oz Cups,120/ 1 OZ/CS,"soybean oil, buttermilk, distilled vinegar, less than 2%  of: salt, egg yolk, sugar, whey protein concentrate,  monosodium glutamate, lactic acid, xanthan gum,  onion* garlic*, natural flavor, spice, potassium  sorbate and sodium benzoate added as preservatives,  calcium disodium edta added to protect flavor.  *dehydrated",-1.0
Sauce Tartar Packets,200/12g/CS,"soybean oil, sweet relish (pickles [cucumbers, distilled white vinegar, salt, calcium chloride], sugar, distilled white vinegar, xanthan gum, aluminum sulfate, natural flavors, spice), water, distilled white vinegar, high fructose corn syrup, salt, egg yolk, enzyme modified egg yolk, modified corn starch, mustard flour, lemon juice concentrate, xanthan gum, onion powder, titanium dioxide, spice, calcium disodium edta added to protect flavor",-1.0
Mayonnaise Bottle Squeeze,12/11.5 OZ/CS,"soybean oil, water, whole eggs and egg yolks, vinegar, salt, sugar, lemon juice, calcium disodium edta (used to protect quality), natural flavors.",-1.0
RP Nuts Kars Cashews 1.5 OZ,12/1.5 OZ/CS,"cashews roasted in peanut and/or sunflower oil, salt.    contains cashews; may contain peanuts and other tree nuts; manufactered in facility with milk and soy",-1.0
Kraft Mayonnaise Packets,200 CT/.44 OZ/CS,"soybean oil, water, eggs, vinegar, contains less than 2% of egg yolks, lemon juice concentrate, salt, sugar, dried onions, dried garlic, paprika, natural flavor, calcium disodium edta (to protect flavor). common allergens present: egg",-1.0
Rice Ruby Wild Blend,6/2#/CS,"long grain parboiled brown rice, sprouted brown rice, colusari red rice, sprouted red rice, b grade wild rice",-1.0
RP Cereal Kind Chocolate Almond,10/1.2 OZ/CS,"ingredients: oats, brown rice, almonds, chicory root fiber, honey, cane sugar, glucose syrup, unsweetened chocolate, palm kernel oil, oat milk powder, canola oil, vegetable glycerin, natural flavor, soy lecithin, sea salt, cocoa butter, vitamin e (tocopherols to maintain freshness).    allergen information: contains almonds and soy. may contain peanuts, tree nuts and sesame seeds. may contain nut shell fragments.",-1.0
RP Mustard Honey Dipping Cups,100/1 OZ/CS,"soybean oil, high fructose corn syrup, honey, water, mustard (vinegar, water mustard seed, salt, turmeric, paprika), distilled vinegar, egg yolks, contains less than 2% of salt, xanthan gum, sodium benzoate & potassium sorbate, (preservatives), paprika, extractive of turmeric, turmeric, spices, calcium disodium edta added to protect flavor.",-1.0
Dressing PM French Original,4/GAL/CS,"soybean oil, high fructose corn syrup, water, distilled vinegar, contains less than 2 % of salt, spice (includes mustard), xanthan gum, propylene glycol alginate, onion*, garlic*, oleoresin paprika (color), paprika. *dehydrated.",-1.0
Rice Brown Medium,25#/BAG,parboiled brown rice. common allergens present: none. ,-1.0
"Cake 8"" Carrots w/Nuts Uniced",18CT/CS,"enirched wheat flour bleached (flour, malted barley flour, niacin, iron, thiamine mononitrate, riboflavin, folic acid), sugar, water, soybean oil, carrots, raisons, pineapple (pineapple, pineapple juice, preservative (ascorbic acid)), walnuts, contains 2% or less of: artificial flavor, buttermilk, caramel color, cellulose gum, cinnamon, defatted soy flour, egg whites, eggs, food starch - modified, glycerin, invert sugar, leavening (baking soda, monocalcium phosphate, sodium aluminum phosphate), molasses, mono-  and diglycerides, palm oil, propylene glycol mono- and diesters of fatty acids, red lake 40, salt, sodium stearoyl lactylate, soy lecithin, spice, wheat starch, yellow corn flour. ",-1.0
Harissa Paste Red Chili ,6/28 OZ/CS,"canola oil, water, red pepper, garlic flakes, salt, cumin, chili pepper, lemon juice, sugar, potassium sorbate (preservative).",-1.0
RP Candy Hershey's Pretzels Dipped,12/4.25 OZ/CS,sugar; enriched wheat flour [flour; niacin; ferrous sulfate; thiamin mononitrate; riboflavin; folic acid]; chocolate; milk; cocoa butter; contains 2% or less of: salt; milk fat; cocoa processed with alkali; tapioca malt; canola oil; lecithin (soy); baking soda; yeast; natural flavor and artificial flavor; pgpr.    in facility that also processes peanuts and tree nuts,-1.0
Chili Oil,12/7 OZ/CS,"soybean oil, dried chili peppers.",-1.0
Dressing Ranch Kosher,4/1 GAL/CS,"canola oil, water, sugar, distilled vinegar, salt, phosphoric acid, modified food starch (corn), xanthan gum, potassium sorbate and sodium benzoate added to enhance freshness, spices, dehydrated garlic, parsley, onion, natural flavors, calcium disodium edta, added to protect flavor.",-1.0
Dressing Mayonnaise Vegan,6/32 OZ/CS,"expeller-pressed canola oil, filtered water, brown rice syrup, apple cider vinegar, soy protein, sea salt, mustard flour, lemon juice concentrate.  ",-1.0
"BD Pie Shells Unbaked 9"" FZ",4/5CT/CS,"enriched flour (wheat flour, niacin, reduced iron, thiamine mononitrate, riboflavin, folic acid), shortening (interesterified soybean oil, fully hydrogenated cottonseed oil), water, contains 2% or less: white grape juice concentrate, salt, citrus fiber, xanthan gum.  ",-1.0
Dressing Ranch PM Packet,120/1.5 OZ/CS,"soybean oil, water, buttermilk, distilled vinegar, salt, egg yolk, sugar, whey protein concentrate, garlic juice, monosodium glutamate, xanthan gum, natural flavor, onion*, potassium sorbate and sodium benzoate added as preservatives, polysorbate 60, garlic*, spice, phosphoric acid, lactic acid, calcium disodium edta added to protect flavor. *dehydrated.",-1.0
Peanut Butter Skippy Cups ,100/.75 OZ,"roasted peanuts, sugar, hydrogenated vegetable oil (cottonseed, soybean and rapeseed oil) to prevent separation, salt. ",-1.0
Dressing Ranch Bulk,4/GAL/CS,"soybean oil, water, distilled vinegar, cultured lowfat buttermilk, sugar, salt, contains less than 2% of nonfat dry milk, egg yolks, garlic, mustard seed, onion, yeast extract, xanthan gum, polysorbate 60, torula yeast, disodium inosinate & disodium guanylate, sodium benzoate and potassium sorbate (as preservatives), lactic acid, spice, parsley, calcium disodium edta added to protect flavor",-1.0
Potsticker Chicken FZ,10/12CT/.67OZ/CS,"cooked chicken meat  (chicken meat, water, potato starch,  salt), wheat flour, cabbage, water,  ground chicken meat, water chestnut,  soybean oil, green onion, contains less  than 2% of each of the following:  textured soy protein concentrate,  ginger, salt, sugar, garlic, potato starch,  sesame oil, seasoning (yeast extract,  maltodextrin, salt), disodium inosinate,  disodium guanylate, soy flour, spice.  contains: soy, wheat",-1.0
Mayonnaise Dispenser,2/1.5 GAL/CS,"soybean oil, distilled white vinegar, egg yolks, salt, sugar, mustard flour, onion powder, lemon juice concentrate, calcium disodium edta added to protect flavor, spice extractives. ",-1.0
ZTF Oil Liquid,35#/CS,"high oleic soybean oil, tbhq (preservative), dimethylpolysiloxane (anti-foaming).",-1.0
Dressing PM Caesar Creamy,4/1 GAL/CS,"soybean oil, water, parmesan cheese (part skim milk, culture, salt, enzymes), distilled vinegar, romano cheese (milk, culture, salt, enzymes), egg yolk, salt, gluconic acid, dried garlic, spices, lemon juice concentrate, dried onion, phosphoric acid, xanthan gum, parsley, anchovy extract",-1.0
Dressing PM 1000 Island Original,4/1 GAL/CS,"soybean oil, water, sugar, pickles, distilled vinegar, tomato paste, salt, contains less than 2% of food starch-modified, egg yolks, mustard flour, xanthan gum, onion*, phosphoric acid, onion, celery seed, mustard seed, red bell pepper*, yeast extract, red bell pepper, calcium disodium edta added to protect flavor, natural flavor. *dehydrated",-1.0
RP Cookie Lenny&Larry Choc Chip Keto,12/1.45 OZ/CS,"palm fruit oil, sugar free chocolate chips (chocolate liquor, cocoa butter, sunflower lecithin, natural vanilla extract), peanut butter, protein blend (pea protein, almond protein), chicory root fiber, organic erythritol, grain free flour blend (lupin flour, arrowroot flour), vegetable glycerine, natural flavor, xanthan gum, baking soda, sunflower lecithin, stevioside, salt, mixed tocopherols    contains: lupin, almond, peanut: may contain: peanut, tree nut, soy, milk, egg and wheat",-1.0
Dressing PM Blue Cheese,4/1 GAL/CS,"soybean oil, water, blue cheese (milk, salt, culture enzymes), distilled vinegar, egg yolk, sugar, salt, rochester sauce concentrate (distilled vinegar, corn syrup, water, salt, dried garlic, spices, celery seed, tamarind, natural flavor), maltodextrin, natural flavor, modified corn starch, modified tapioca starch, xanthan gum, cultured dextrose, dried garlic, mustard flour. ",-1.0
Transfer Sheets Florets Chocolate,25 CT/CS,"hydrogenated palm kernel oil and soy lecithin. may contain: titatnium dixoide, fd&c yellow #5 & 6, fd&c blue #1 & 2, fd&c red #40 & carmine.",-1.0
Dressing PM Italian Classic,4/1 GAL/CS,"soybean oil, water, red wine vinegar, white wine vinegar, sugar, salt, contains less than 2% of romano cheese (pasteurized part skim milk, salt, cheese cultures, enzymes, calcium chloride), parmesan cheese (pasteurized milk, cheese cultures, salt, enzymes), red bell pepper, onion, spices, garlic, xanthan gum, calcium disodium edta added to protect flavor",-1.0
Chip Tortilla Whole Grain Tostitos,64/1.45 OZ/CS,"whole corn, corn, vegetable oil (corn, canola and/or sunflower oil), and salt",-1.0
Oil Olive Extra Virgin,6/2 Ltr/CS,extra virgin olive oil.,-1.0
RP Eggs on the Run Cheese 2PK,12/2 CT/CS,"hard boiled eggs (egg, water, citric acid, sodium benzoate), milk cheddar cheese (pastuerized milk, cheese culture, salt, enzymes, color added), salt (salt, sodium silicoaluminate, dextrose, potassium iodide), black pepper ",-1.0
RP Nuts Second Nature California Medley,1/5 OZ/CS,"almonds (almonds, peanut and/or sunflower oil). raisins. dried cranberries (cranberries, sugar, sunflower oil). pistachio kernels    manufactered in facility with soy and milk",-1.0
RP Gum Ice Breaker Duo Watermelon Mint,8/33CT/CS,sorbitol; contains 2% or less of; maltodextrin; malic acid; maltitol; aspartame*; magnesium stearate; citric acid; natural and artificial flavor; medium chain triglycerides; hydrogenated vegetable oil (soybean and palm oil); soy lecithin; modified cornstarch artificial color (red 40 lake; red 40; blue 1). **phenylketonurics,-1.0
RP Nuts Kars Cashews Tube 12 OZ,18/12OZ/CS,"cashews roasted in peanut and/or sunflower oil, salt.    contains cashews; may contain peanuts and other tree nuts; manufactered in facility with milk and soy",-1.0
RP Candy Milk Choc Ice Cube Alberts,100 CT/CS,"partially hydrogenated coconut oil, sugar, low fat cocoa, dried sweet whey, soy flour, hazelnut paste, soy lecithin, artifial vanilla flavor ",-1.0
RP Chip GL Potato Prmsn Ranch 1.4oz,40/1.38OZ/CS,"potatoes, sunflower and or canol oil, whey, salt, buttermilk solids, dextrose, onion powder, natural flavors, parmeasan cheese (milk, salt, cultures, enzymes), citric acid, spice, garlic powder, (may contain sunflower oil and silicon dioxide as processing aids).",-1.0
Oil Olive Xtra Virgin Canola Blend 75/25,6/GAL/CS,canola oil and extra virgin olive oil. ,-1.0
Peanut Butter Smooth Skippy ,6/4#/CS,"roasted peanuts, sugar, hydrogenated vegetable oil (cottonseed, soybean and rapeseed oil), salt.",-1.0
Rice Long Grain,25#/CS,"parboiled long grain rice enriched with iron (ferric phosphate), niacin, thiamine, mononitrate, & folic acid. common allergens present: none. ",-1.0
Coconut Oil,12/400 mL/CS,coconut oil,-1.0
Shortening  All Purpose ZTF,50#/CS,palm oil.,-1.0
Peanut Butter Cups,200 CT/CS,"roasted peanuts, sugar, hydrogenated vegetable oil (rapeseed, cottonseed, and soybean oils), salt.",-1.0
RP Oil Vegetable Crisco ,1/16 OZ/CS,canola oil ,-1.0
Dressing Mustard Honey Dijon PM Packet,60/1.5 OZ/CS,"soybean oil, high fructose corn syrup, water, dijon mustard (water, mustard seed, distilled vinegar, salt, white wine, citric acid, turmeric (color), tartaric acid, spices), distilled vinegar, honey, modified corn starch, egg yolk, mustard flour, xanthan gum, salt, sodium benzoate and potassium sorbate (preservatives), caramel color, calcium disodium edta (to protect quality), annatto and turmeric extracts (color). ",-1.0
Shortening Sweetex,50#/CS,"palm oil, mono and diglycerides, polysorbate 60",-1.0
Dressing PM Honey Dijon Mustard,4/1 GAL/CS,"soybean oil, water, dijon mustard (distilled vinegar, water, mustard seed, salt, white wine, citric acid, turmeric, tartaric acid, spices) honey, distilled vinegar, modified corn starch, egg yolk, mustard flour, xanthan gum, salt, sodium benzoate and potassium sorbate (preservatives), calcium disodium edta (to protect quality).",-1.0
Mayonnaise Packet Stick,210 CT/CS,"soybean oil, water, liquid whole egg and yolk, vinegar, salt, sugar, concentrated lemon juice, calcium disodium edta, natural flavor.",-1.0
Cookie Metro Frosted Block M,PACKAGES,"cookies: all-purpose flour, margarine (liquid and partially hydrogentated soybean oil, water, salt, whey solids, soy lecithin, vegetable mono & diglycerides, sodium benzoated (a preservative), natural and artificial flavor, vitamin a palmitate added), butter (cream, natural flavorings), powdered sugar, baking powder (sodium acid pyrophosphate, sodium bicarbonate, corn starch and monocalcium phosphate), vanilla flavoring.  icing: sugar, water, corn syrup, agar, artificial color, potassium sorbate (preservative), citric acid, natural and artificial flavor, locust bean gum, mono and diglycerides.  food coloring for icing: high fructose corn syrup, water, glycerine corn syrup, modified food starch, sorbitol citric acid, sodium benzoate, and potassium sorbate (preservative), carrageenan gum, agar gum.  may contain fd&c: yellow 5, yellow 6, red 40, red 3, blue 1, blue 2, rojo 40, amarillo 5, azul 1",-0.976
RP Pretzel Dots Honey Mustard,1/2.5OZ/CS,"enriched wheat flour (wheat flour, niacin, reduced iron, thiamin mononitrate, riboflavin, folic acid), vegetable oil (may contain one or more of the following: canola, corn, soybean), granulated sugar, brown sugar, honey, salt, less than 2% of yeast, salad mustard powder (salad mustard (distilled vinegar, mustard seed, salt, turmeric), maltodextrin, modified corn starch, natural flavor), maltodextrin, mustard, garlic powder, turmeric, spices, onion powder, natural flavor, silicon dioxide, whey, vinegar, citric acid, malic acid, expeller pressed sunflower oil, gum arabic, extractives of paprika, mustard oil.",-0.973
Spring Roll Shrimp Maui,100/1 OZ/CS,"spring roll ingredients: (bleached wheat flour, water, salt, disodium phosphate, sodium bicarbonate, and soybean oil), sealed  with: corn starch, water. filling: shrimp (shrimp, salt, sodium phosphates, may contain sodium bisulfite), ground chili paste (chili, salt, distilled vinegar, potassium sorbate and sodium bisulfite as preservative and xanthan gum), cream of coconut (coconut, sugar, water,  polysorbate 60, sorbitol monostearate, salt, propylene glycol alginate, mono and diglycerides [emulsifiers], citric acid, guar gum locust bean), and  or (coconut meat juice, sugar, polyoxymethylene stearate [an emulsifier], carboxymethyl cellulose and xanthan gum [thickeners], citric acid,  sorbitol monostearate [an emulsifier], salt), leeks, curry paste (dried red chilies, garlic, shallots, lemon grass, sugar, salt, kaffir lime, galangal,  spices [coriander seeds, cumin, cardamon, bay leaves), cilantro, garlic powder, seasoning salt (salt, sugar, paprika, spices, dextrose, chili pepper, dehydrated onion, turmeric, natural flavor, black pepper, red pepper, dehydrated garlic, and less than 2 % tricalcium phosphate), lemon pepper (salt, black pepper, citric acid, onion, sugar, garlic, tricalcium phosphate, silicon dioxide [to make free flowing], celery seed, lemon oil, and  yellow lake #5), black pepper.",-0.972
RP Combos Pretzel Pizzeria 6.3 OZ,1/6.3 OZ/CS,"wheat flour, palm oil, dairy product solids, maltodextrin, modified corn starch; less than 2% of: salt, tomato powder, leavening (baking soda, sodium acid pyrophosphate), bakers and cheddar cheese blend (milk, cheese cultures, salt, enzymes), dextrose, soy lecithin, buttermilk, natural and artificial flavors, onion powder, spices, garlic powder, lactic acid, whey, citric acid, colors (yellow 5 lake, yellow 6 lake, red 40 lake, blue 1 lake), whey protein concentrate, malic acid, sugar, disodium inosinate, disodium guanylate, wheat, soybeans, paprika extract.  contains milk, wheat and soy.",-0.971
