RP Chip SBRays BBQ 3oz,12/3 OZ/CS,"potatoes, vegetable oil (contains one or more of the following: corn, sunflower or cottonseed oil), salt, sugar, dextrose, torula yeast, onion & garlic powder, citric acid, natural smoke flavor, spice, spice extractives (including extractives of annatto, turmeric and paprika),     manufactured on equipment that processes products containing dairy, soy and wheat.",-1.8
RP Popcorn Savory Foods Choc Delight,10/3.5 OZ/CS," dark chocolate (sugar, vegetable oil [palm kernel oil and hydrogenated palm kernel oil], cocoa powder processed with alkali, nonfat dry milk solids, soy lecithin [emulsifier], salt, artificial flavor), popcorn, brown sugar (granulated sugar, refined cane molasses syrup), corn syrup, white chocolate (sugar, vegetable oil [palm kernel oil and hydrogenated palm kernel oil], nonfat dry milk solids, whole milk solids, soy lecithin [emulsifier], natural flavor, salt, artificial flavor), sugar, water, butter (pasteurized cream, salt), pan release (corn oil, lecithin, beta carotene [color], artificial butter flavor), vanilla, baking soda (sodium bicarbonate), salt.    contains milk and soy; manufactured in facility using peanuts and tree nuts",-1.8
RP Bar Granola Quaker PB & Chocolate,12/8 CT/CS,"granola (whole grain oats, brown sugar, brown rice crisp [whole grain brown rice flour, sugar, salt], whole grain wheat, soybean oil, whole wheat flour, baking soda, soy lecithin, nonfat dry milk), corn syrup, brown rice crisp (whole grain brown rice flour, sugar, salt), semisweet chocolate chips (sugar, chocolate liquor, cocoa butter, soy lecithin, vanilla extract), peanut butter spread (peanuts, sugar, palm oil, salt), peanut flavored chips (sugar, palm kernel and palm oil, partially defatted peanut flour, lactose, whey, dextrose, corn syrup solids, soy lecithin, salt, natural flavor), invert sugar, corn syrup solids, glycerin, contains 2% or less of: calcium carbonate, sorbitol, salt, natural flavor, tocopherols (to preserve freshness).    contains: milk, peanut, soy and wheat; may contain tree nuts",-1.795
RP Bar Quaker Chewy Big Chocolate PB,10/1.48 OZ/CS,"granola (whole grain oats, brown sugar, brown rice crisp [whole grain brown rice flour, sugar, salt], whole grain wheat, soybean oil, whole wheat flour, baking soda, soy lecithin, nonfat dry milk), corn syrup, brown rice crisp (whole grain brown rice flour, sugar, salt), semisweet chocolate chips (sugar, chocolate liquor, cocoa butter, soy lecithin, vanilla extract), peanut butter spread (peanuts, sugar, palm oil, salt), peanut flavored chips (sugar, palm kernel and palm oil, partially defatted peanut flour, lactose, whey, dextrose, corn syrup solids, soy lecithin, salt, natural flavor), invert sugar, corn syrup solids, glycerin, contains 2% or less of: calcium carbonate, sorbitol, salt, natural flavor, tocopherols (to preserve freshness).    contains: milk, peanut, soy and wheat; may contain tree nuts",-1.795
RP Bar Nature Valley S&S Granola Almond,16/ 1.2OZ/ CS,"almonds, corn syrup, whole grain oats, sugar, rice flour, palm kernel oil, vegetable glycerin, honey roasted almond butter (almonds, honey, maltodextrin, palm oil, mixed tocopherols), fructose, whey, canola oil, salt, soy lecithin, corn starch, barley malt extract, baking soda, natural flavor, vitamin e (mixed tocopherols) added to retain freshness.    contains: almond, milk, soy; may contain: peanut",-1.792
RP Chip Tostitos Rounds Salsa Verde,28/2.63 OZ/CS,"ingredients: corn, vegetable oil (corn, canola, and/or sunflower oil), maltodextrin (made from corn), salt, monosodium glutamate, sugar, dextrose, tomato powder, paprika spices, natural flavors, onion powder, garlic powder, yeast extract, artificial color (yellow 6 lake, yellow 5 lake, red 40 lake, blue 1 lake) and artificial flavors.",-1.789
DST Shortbreads Chocolate Raspberry,2/48CT/CS,"white coating compound [sugar, palm kernel oil, whole milk, non-fat milk, whey, hydrogenated palm oil, soy lecithin (emulsifier), natural vanilla], unsalted butter [pasteurized cream, natural flavorings], unbleached flour: wheat flour, niacin, reduced iron, thiamin mononitrate, riboflavin, enzyme, folic acid, confectioner's sugar, cocoa [high fat cocoa processed with potassium carbonate], shortening, raspberry extract, liquor, whole milk, salt, vanilla extract [ vanilla, water, alcohol, caramel color].",-1.786
Burger Plant Based Beyond Meat,1/10 LB/CS,"water, pea protein,* expeller pressed canola oil, refined coconut oil, rice protein, natural flavors, dried yeast, cocoa butter, methylcellulose, contains 1% or less: potato starch, salt, potassium chloride, beet juice color, apple extract, pomegranate concentrate, sunflower lecithin, vinegar, lemon juice concentrate, vitamins and minerals (zinc sulfate, niacinamide [vitamin b3], pyridoxine hydrochloride [vitamin b6], cyanocobalamin [vitamin b12], calcium pantothenate).   ",-1.783
Beef Ground Beyond Plant Based,6/2#/CS,"water, pea protein*, expeller-pressed canola oil, refined coconut oil, rice protein, natural flavors, dried yeast, cocoa butter, methylcellulose, contains 1% or less: potato starch, salt, potassium chloride, beet powder color, apple extract, pomegranate concentrate, sunflower lecithin, vinegar, lemon juice concentrate, vitamins and minerals (zinc sulfate, niacinamide [vitamin b3], pyridoxine hydrochloride [vitamin b6], cyanocobalamin [vitamin b12], calcium pantothenate).    *peas are legumes. people with severe allergies to legumes like peanuts should be cautious when introducing pea protein into their diet because of the possibility of a pea allergy. contains no peanuts or tree nuts.   ",-1.783
RP Stouffers Meatloaf Bulk 9 OZ FZ,12/9 OZ/CS,"beef broth, cooked beef, water, onions, soy protein concentrate, 2% or less of tomato puree (water, tomato paste), modified cornstarch, rolled oats, whey protein concentrate, green bell peppers, soybean oil, vital wheat gluten, bleached wheat flour, salt, seasoning (water, flavor, maltodextrin, salt, caramel color, less than 2% of lactic acid, enzyme modified cream), worcestershire sauce (distilled vinegar, molasses, corn syrup, water, salt, caramel color, garlic powder, sugar, spices, tamarind, natural flavor), potassium chloride, dried soy sauce (soybeans, salt, wheat), sugar, caramel color, soy sauce (water, soybeans, wheat, salt), beef fat, autolyzed yeast extract, mono- and diglycerides, dried garlic, spice, natural flavors, canola oil, beef flavor (dried beef broth, maltodextrin, salt, flavoring, disodium phosphate, grill flavor [from vegetable oil], smoke flavor), xanthan gum, seasoning (autolyzed yeast extract, gum arabic, beef stock concentrate, beef, flavor, salt, sodium phosphates), maltodextrin, cultured whey, seasoning (maltodextrin, flavor, cultured whey, dextrose, fructose, salt), onion powder, seasoning (salt, dried beef broth, flavoring, maltodextrin, beef fat, disodium phosphate, grill flavor [from vegetable oil], modified cornstarch, smoke flavor), cellulose gel, lactic acid, corn oil, dextrose.",-1.782
RP Stouffers Meatloaf 9 OZ FZ,1/9 OZ/CS,"beef broth, cooked beef, water, onions, soy protein concentrate, 2% or less of tomato puree (water, tomato paste), modified cornstarch, rolled oats, whey protein concentrate, green bell peppers, soybean oil, vital wheat gluten, bleached wheat flour, salt, seasoning (water, flavor, maltodextrin, salt, caramel color, less than 2% of lactic acid, enzyme modified cream), worcestershire sauce (distilled vinegar, molasses, corn syrup, water, salt, caramel color, garlic powder, sugar, spices, tamarind, natural flavor), potassium chloride, dried soy sauce (soybeans, salt, wheat), sugar, caramel color, soy sauce (water, soybeans, wheat, salt), beef fat, autolyzed yeast extract, mono- and diglycerides, dried garlic, spice, natural flavors, canola oil, beef flavor (dried beef broth, maltodextrin, salt, flavoring, disodium phosphate, grill flavor [from vegetable oil], smoke flavor), xanthan gum, seasoning (autolyzed yeast extract, gum arabic, beef stock concentrate, beef, flavor, salt, sodium phosphates), maltodextrin, cultured whey, seasoning (maltodextrin, flavor, cultured whey, dextrose, fructose, salt), onion powder, seasoning (salt, dried beef broth, flavoring, maltodextrin, beef fat, disodium phosphate, grill flavor [from vegetable oil], modified cornstarch, smoke flavor), cellulose gel, lactic acid, corn oil, dextrose.",-1.782
RP Chip Veggie Straws Ranch 2.75 OZ,6/2.75 OZ/CS,"potato starch, potato flour, expeller pressed canola oil and/ or sunflower oil and/or safflower oil, seasoning (buttermilk, salt, maltodextrin, garlic powder, coconut oil, yeast extract, sour cream (cream, nonfat milk, cultures), dextrose, onion powder, natural flavors, tomato powder, citric acid, cream, cultured nonfat milk, spices, paprika, sugar, lactic acid, vinegar, nonfat milk, dehydrated red pepper, dehydrated carrot,dehydrated green bell pepper, whole milk powder, sodium caseinate, cultured buttermilk, whey, milk fat), corn starch, calcium chloride, cane sugar, salt, potassium chloride, spinach powder, tomato paste, beetroot powder (color). turmeric extract (color)",-1.78
RP Candy Hi-Chew Tropical Mix 3.5,3.5 OZ/CS," glucose syrup, sugar, vegetable oil (hydrogenated palm kernel oil, palm kernel oil), less than 2% of gelatin, malic acid, natural and artificial flavors, citric acid, mango puree, chia seeds, kiwi puree, maltodextrin, apple juice concentrate, pineapple juice concentrate, sucrose fatty acid esters, sorbitan monostearate, fruit juice concentrate (color), vegetable juice concentrate (color), honey, ascorbic acid (vitamin c), beta-carotene (color), soy lecithin. contains soybeans.",-1.773
RP York St Sandwich Tuna Salad Wheat,1 CT,"ingredients: lemon pepper tuna salad (tuna (light tuna, water, vegetable broth, salt), mayonnaise (soybean oil, water, egg yolks, distilled vinegar, contains 2% or less of salt, sugar, mustard seed, calcium disodium edta added to protect flavor), celery, lemon pepper seasoning (salt, spices (including black pepper), citric acid, onion, sugar, garlic, calcium stearate, silicon dioxide and calcium silicate (to make free flowing), lemon oil, riboflavin (color))), wheat bread (wheat flour, water, whole wheat flour, wheat bran, yeast, high fructose corn syrup, wheat gluten, contains 2% or less of the following: soybean oil, salt, honey, molasses, invert sugar, corn syrup, wheat starch, calcium propionate (preservative), sodium stearoyl lactylate, ammonium sulfate, ascorbic acid, citric acid, calcium sulfate, enzymes.)",-1.75
Indian Samosa Vegan,200 CT/CS,"shell (wheat flour, water, soybean oil, salt), vegetable blend (potatoes, green peas, soybean oil, oil, green chili, spices, ginger, salt).",-1.75
Sabatino Oil White Truffle,6/8.4 OZ/CS,"olive oil, white truffle flavoring compound (canola oil, natural white truffle extract, white truffle flavor).",-1.75
RP Chex Mix Chocolate Turtle 4.5 OZ,7/4.5 OZ/CS,"enriched corn meal (degermed yellow corn meal, niacin, iron, thiamin mononitrate, riboflavin, folic acid), enriched wheat flour (wheat flour, niacin, iron, thiamin mononitrate, riboflavin, folic acid), sugar, vegetable oil (palm, soybean, canola, rice bran and/or peanut), candy coated chocolate flavored pieces (sugar, hydrogenated palm kernel oil, cocoa powder, whey, nonfat milk, soy lecithin, vanilla, color [red 40 lake, yellows 5 & 6 lake and other color added], gum arabic, corn syrup, confectioner’s glaze [carnauba wax, mineral oil]), peanuts, high fructose corn syrup, popcorn. contains 2 % or less of: salt, fructose, molasses, cocoa processed with alkali, soy lecithin, distilled monoglycerides, cocoa, yeast, baking soda, yellow corn flour, corn starch, natural flavor, barley malt syrup, xanthan gum. freshness preserved by bht & tbhq.  contains wheat, peanut, milk and soy ingredients.",-1.75
Icing Base Chocolate,40#/CS,"cocoa processed with alkali, palm oil, soybean oil, contains 2% or less of: artificial flavor, mono and diglycerides, polysorbate 60, preservative (sorbic acid), propylene glycol, salt, soy lecithin, unsweetened chocolate, water. ",-1.75
RP Chip Pringles Salt & Vinegar 5.57oz,14/5.57 OZ/CS,"dried potatoes, vegetable oil (corn, cottonseed, high oleic soybean and/or sunflower oil), degerminated yellow corn flour, cornstarch, rice flour, maltodextrin, mono- and diglycerides, lactose. contains 2% or less of salt, sodium diacetate, vinegar, dextrose, malic acid, turmeric color, wheat starch.",-1.75
Sauce Curry Japanese,10 CT/CS,"wheat flour, edible oils (palm oil, canola oil), salt, sugar, curry powder, spices, caramel, monosodium glutamate, malic acid, disodium guanylate, disodium inosinate.",-1.75
RP Beef Stuffed Foods Empanada 1 OZ,150 CT/CS,"enriched wheat flour (wheat flour, malted barley flour, niacin, reduced iron, thiamine mononitrate, riboflavin, folic acid), beef, water, whole plum tomatoes (plum tomatoes, tomato juice, basil, salt, naturally derived citric acid), potato, butter(pasteurized cream, salt), onions, 2% or less of romano cheese made from cow's milk (pasteurized cow's milk, cheese cultures, salt, enzymes), manzanilla olives (manzanilla olives, water, salt, lactic acid), olive oil, cilantro, poblano peppers, ground nacho chip (stone ground corn flour, sunflower oil, sea salt), sea salt, garlic, yeast, red pepper, brown sugar, baking powder (sodium acid pyrophosphate, sodium bicarbonate, corn starch and monocalcium phosphate), scallion, jalapeno peppers, adobo paste (water, tomato paste, dried chipotle peppers, distilled vinegar, corn oil, 2% or less or iodized salt (potassium iodate), corn starch, onion powder, garlic powder, spices), masa flour (yellow corn, lime), liquid whole eggs with citric acid (whole egg, citric acid), dough conditioner (enriched wheat flour), vegetable base (carrot, celery, onion, tomato paste, corn oil, yeast extract, potato flour, salt, onion powder, garlic powder, natural flavor), organic balsami vinegar (wine vinegar, concentrated grape must), lime juice, spices.",-1.736
Patty Veggie Cauliflower Quinoa FZ,48/3.2 OZ/CS,"cooked quinoa, rice and beans (water, red & white quinoa, long grain, brown, red and wild rice (enriched with iron (ferric phosphate), niacin, thiamine, mononitrate & folic acid), black bean, red bean, canola and olive oil, onion, vegetable base ((cooked vegetables (carrots, celery, onion), tomato paste, corn oil, yeast extract, potato flour, salt, onion powder, garlic powder and flavoring), cauliflower, water, soy flour, farro, oats, onion, red peppers, chickpea flour, less than 2% of garlic, egg (egg citric acid, water), canola and olive oil, sea salt, agave, basil, scallion, tamari sauce (water, soybeans, salt, sugar), balsamic vinegar (wine vinegar, grape must, caramel [color], contains sulfites), brown sugar, spices.",-1.735
RP Ice Cream B&J Chubby Hubby Pint FZ,8/1 PT/CS,"cream, skim milk, liquid sugar (sugar, water), water, sugar, peanuts, wheat flour, coconut oil, partially defatted peanut flour, egg yolks, peanut oil, barley malt, milk, salt, cocoa (processed with alkali), unsweetened chocolate, guar gum, soybean oil, malted barley flour, vanilla extract, enzymes, soy lecithin, baking soda, carrageenan, cocoa. contains eggs, milk, peanuts, soy and wheat. may contain tree nuts.",-1.724
Fritter Quinoa Zucchini GF,100 CT/CS,"quinoa (red), water, zucchini, egg (whole egg, citric acid, water), feta cheese (cultures pasteurized milk, salt, enzymes), lemon juice (lemon juice from concentrate [water, concentrated lemon juice] and less than 2% of  sodium benzoate, sodium metabisulfite and sodium sulfite {preservative}, lemon oil]), extra virgin olive oil with natural lemon flavor (extra virgin olive oil natural lemon flavor), pine nuts (toasted), scallions, corn flour, rice flour, salt, cilantro, gluten free bread crumbs (rice flour, pea protein, dextrose), dill, parsely, black  pepper, coating ingredients: herb gluten free bread crumbs (tapioca starch, water, potato starch, potato flour,  palm oil, natural vinegar, honey, egg yolks, salt, herbs, ground garlic, black pepper) and/or gluten free bread  crumbs (rice flour, pea protein, dextrose), egg (whole eggs, citric acid, water).",-1.721
Dressing Ranch Chipotle,4/GAL/CS,"soybean oil, water, cultured lowfat buttermilk, distilled vinegar, chipotle in adobo sauce (chipotle pepper [water, dried chipotle pepper], tomato paste, distilled vinegar, soybean oil, sugar, salt, spices, onion*, garlic*, sodium benzoate [a preservative] caramel color), sugar, contains less than 2% of: egg yolks, salt, xanthan gum, spices, onion*, garlic*, parsley*, buttermilk, polysorbate 60, lactic acid, sodium benzoate (a preservative), calcium disodium edta added to protect flavor. *dehydrated.",-1.714
RP Ice Cream B&J Pint Tonight Dough FZ,8/1 PT/CS,"cream, liquid sugar (sugar, water), skim milk, water, wheat flour, sugar, brown sugar, cocoa (processed with alkali), canola oil, egg yolks, peanut butter (peanuts), corn syrup, eggs, cocoa, butter (cream, salt), coconut oil, expeller pressed soybean oil, chocolate liquor, salt, tapioca flour, guar gum, natural flavor, soy lecithin, baking soda, molasses, vanilla extract, carrageenan, cocoa butter, milk. contains eggs, milk, peanuts,soy and wheat. ",-1.706
RP York St Salad Pear & Walnut,1 CT,"rustic spring mix, red balsamic vinaigrette (vegetable oil (soybean and/or canola oil), water, balsamic vinegar, sugar, sherry wine, red wine vinegar, romano cheese [(pasteurized cow's milk, cultures, salt, enzymes (microcrystalline cellulose, added to prevent caking)], olive oil, salt, dijon mustard (white distilled vinegar and water, #1 grade mustard seed, water, salt, chardonnay wine, citric acid, onion powder, turmeric, spices, natural flavoring), shallots, distilled vinegar, basil, spices, dehydrated garlic, extractive of rice, xanthan gum (a natural thickener), dehydrated onion, lemon juice concentrate, dehydrated red bell pepper), pears, water, sugar, walnuts, blue cheese (pasteurized milk, cheese cultures, salt, enzymes), powdered cellulose to prevent caking, natamycin to protect flavor",-1.705
RP Hostess Cinnamon Roll,6/4 OZ/CS,"enriched flour (wheat flour, malted barley flour, niacin, ferrous sulfate or reduced iron, thiamine mononitrate, riboflavin, folic acid), water, sugar, palm oil, contains 2% or less: yeast, cinnamon, mono and diglycerides, salt, dextrose, glycerin, whey, egg white, cornstarch, preservative (calcium propionate, sodium propionate, potassium sorbate, sorbic acid), cocoa processed with alkali, soybean oil, calcium carbonate, natural and artificial flavor, molasses, mineral oil, guar gum, sodium stearoyl lactylate, soy lecithin, egg, sodium acid pyrophosphate, baking soda, calcium sulfate, ascorbic acid, enzymes, fumaric acid, color (beta carotene, titanium dioxide), citric acid, vitamin a palmitate, agar, calcium lactate.  contains egg, milk, soy & wheat",-1.702
Margarine Butter Spread Cups Whipped,900/5 GRAM/CS,"water, liquid and hydrogenated soybean oil, palm oil, contains less than 2% of salt, vegetable mono & diglycerides, potassium sorbate (a preservative), citric acid, natural & artificial flavor, beta carotene (color), vitamin a palmitate added. ",-1.7
Cheese Cheddar Shredded Vegan,3/5#/CS,"filtered water, tapioca flour, coconut oil, expeller pressed: canola and/or safflower oil, vegan natural flavors, chickpea protein, salt, tricalcium phosphate, lactic  acid (vegan), konjac flour, yeast extract, xanthan gum, annatto color, turmeric color, nutritional yeast, potassium salt.   ",-1.688
RP Ice Cream BB Sundae Monster Cookie,8/8OZ/CS,"buttermilk, milk, peanut butter (peanuts, salt), dextrose, m&m candies [{milk chocolate (sugar, chocolate, skim milk, cocoa butter, lactose, milkfat, soy lecithin, salt, artificial and natural flavors), sugar, for color (blue 1 lake, red 40, yellow 6, yellow 5, blue 1, red 40 lake, yellow 6 lake, yellow 5 lake, blue 2 lake, blue 2), corn syrup, dextrin, cornstarch, carnauba wax}, cocoa butter], sugar, soybean oil, whey, cream, coconut oil, high fructose corn syrup, brown sugar, wheat flour, skim milk, contains 2% or less of cocoa processed with alkali, cocoa, dry roasted peanuts, glycerin, oats, palm oil, propylene glycol monoesters, guar gum, carob bean gum, natural flavors, salt, unsweetened chocolate, cocoa butter, soy lecithin, vanilla extract, hydrogenated palm kernel oil, mono & diglycerides, baking soda, water, corn starch, peanut oil, cellulose gel, cellulose gum, carrageenan, yellow 5 lake, yellow 6 lake, yellow 6, blue 1 lake.    ",-1.687
Sausage Morning Star Veg Breakfast FZ,112/1.34OZ/CS,"water, wheat gluten, soy flour, egg whites, corn oil, soy protein concentrate, sodium caseinate, modified tapioca starch, contains 2% or less of soybean oil, soy protein isolate, lactose, autolyzed yeast extract, spices, methylcellulose, natural and artificial flavors, sodium tripolyphosphate, salt, hydrolyzed wheat protein, disodium inosinate, caramel color, whey, hydrolyzed soy protein, hydrolyzed corn gluten, potassium chloride, disodium guanylate, dipotassium phosphate, onion powder, tetrasodium pyrophosphate, sodium hexametaphosphate, succinic acid, dried yeast, monosodium phosphate, lactic acid.vitamins and minerals: niacinamide, iron (ferrous sulfate), vitamin b1 (thiamin mononitrate), vitamin b6 (pyridoxine hydrochloride), vitamin b2 (riboflavin), vitamin b12.",-1.684
RP Bar MET-Rx 100 Crispy Apple Pie,9/3.52 OZ/CS,"soy crisps (soy protein isolate, tapioca starch, salt), apple layer (fruit [apple puree concentrate, apple juice concentrate], sugar, glucose syrup, glycerol, palm fat, rice starch, malic acid, natural flavor, calcium lactate, citrus fiber, sunflower lecithin), yogurt flavored coating (sugar, palm kernel oil, nonfat dry milk solids, yogurt powder [cultured whey protein concentrate, cultured skim milk], soy lecithin, salt, natural flavor), corn syrup, metamyosyn® v100 protein blend (whey protein isolate, milk protein isolate, whey protein concentrate, dried egg white, l-glutamine), maltitol syrup, crystalline fructose, dried apples, fractionated palm oil, glycerin, water, canola oil (with tocopherols added to protect flavor), ground cinnamon, natural flavor, fructooligosaccharides, xanthan gum, vitamin and mineral blend (tricalcium phosphate, ascorbic acid, d-alpha tocopheryl acetate, niacinamide, zinc oxide, copper gluconate, d-calcium pantothenate, vitamin a palmitate, pyridoxine hydrochloride, riboflavin, thiamin mononitrate, folic acid, biotin, potassium iodide, cyanocobalamin), dipotassium phosphate, salt, soy lecithin, almond butter, peanut flour.  contains milk, egg, soy, peanut and tree nut (almond) ingredients.  ",-1.683
DST Danish Raspberry Crown ,3.53 OZ/48 CT,"danish crown with 19% raspberry filling: wheat flour, margarine (palm and canola oil, water, mono- and diglycerides, salt, citric acid, natural flavoring, vitamin a), raspberry filling (raspberry (heat treated)(11%), sugar, water, native starch, gellan  gum, potassium sorbate, sodium citrate, citric acid), water, almond filling (sugar, invert sugar syrup, water, palm and canola oil, almonds, soy beans, modified food starch, white beans, whey powder, apricot kernels, salt, whole milk powder, milk proteins, coconut fat, calcium sulphate, mono- and diglycerides, polyphosphates, sodium alginate, citric acid, beta-carotene, flavorings), eggs (heat treated), yeast, glazing (water, sugar, isomalt, glucose syrup, agar, citric acid), sugar, improver (esters of mono- and diglycerides, wheat flour, canola oil, ascorbic acid, enzymes), salt. ",-1.679
Roll Dinner Hawaiian FZ ,10/12 CT/CS,"unbleached enriched flour [wheat flour, malted barley flour, reduced iron, thiamine mononitrate (vitamin b1), riboflavin (vitamin b2), niacin (vitamin b3), folic acid], yeast, sugar, water, wheat gluten, natural oil blend (soybean, palm fruit, canola oil), wheat protein isolate, salt, yellow corn flour, spice oils (turmeric and annatto), monoglycerides, sodium stearoyl lactylate, calcium propionate and potassium sorbate (preservatives), lactic acid, natural and artificial flavors, datem, calcium sulfate, citric acid, ascorbic acid, modified food starch, sodium alginate, mono- and diglycerides, polysorbate 60.",-1.677
Biscuit Stuffed Sausage Cheddar,36 CT/CS,"biscuit [enriched flour bleached [wheat flour, niacin, ferrous sulfate, thiamin mononitrate, riboflavin, folic acid, water, soybean oil, hydrogenated soybean oil, buttermilk, sugar, sodium aluminium phosphate, salt, baking soda, datem, nonfat milk, whey protein concentrate, calcium acid pyrophosphate, potassium bicarobonate, whey protein isolate, pectin, cream, natural flavor], flour [wheat flour, niacin, reduced iron, thamin mononitrate, riboflavin, enzymes, folic acid], sausage patty [pork, water, salt, corn syrup solids, sugar, dextrose, caramel color, bha, propyl gallate, citric acid], cheddar cheese [pasteurized milk, cheese culture, salt, enzymes, annotto coloring, cellulose) ",-1.674
