RP Bar Kind Dark Chocolate Nuts Sea Salt,12/1.4 OZ/CS,"almonds, peanuts, chicory root fiber, honey, palm kernel oil, sugar, glucose syrup, rice flour, unsweetened chocolate, alkalized cocoa, sea salt, soy lecithin, natural flavor, cocoa butter.    allergen information: contains: almonds, peanuts and soy. may contain tree nuts and sesame seeds. may contain nut shell fragments.",-0.733
RP Pasta Kraft Velveeta Mac Original,10/2.39 OZ/CS,"enriched macaroni product (wheat flour, niacin, ferrous sulfate [iron], thiamin mononitrate [vitamin b1], riboflavin [vitamin b2], folic acid), cheese sauce (whey, canola oil, cheddar cheese [milk, cheese culture, salt, enzymes], whey protein concentrate, milk, milk protein concentrate, sodium phosphate, contains less than 2% of salt, lactic acid, sodium alginate, sorbic acid as a preservative, oleoresin paprika [color], enzymes, cheese culture, annatto extract [color], milkfat, natural flavor).",-0.731
Bread Multigrain Artisan Sandwich,8CT/CS,"water, gluten free blend (corn starch, modified tapioca starch, tapioca starch, potato starch, sorghum flour, white rice flour, brown rice flour, amaranth flour), canola oil, sugar, psyllium, yeast, contains 2% or less of dried egg white, invert sugar, whole flax seeds, corn flakes, sunflower seeds, millet, pumpkin seeds, salt, cultured corn syrup solids, molasses powder, modified cellulose gum, cellulose gum, powdered cellulose, xanthan gum, enzymes, niacin, reduced iron, thiamine mononitrate, riboflavin, folic acid.",-0.727
RP Poptart Blueberry Frosted Box 6/2PK,6/3.52OZ/CS,"enriched flour (wheat flour, niacin, reduced iron, vitamin b1 [thiamin mononitrate], vitamin b2 [riboflavin], folic acid), corn syrup, high fructose corn syrup, dextrose, soybean and palm oil (with tbhq for freshness), sugar, bleached wheat flour.contains 2% or less of wheat starch, salt, dried blueberries, dried grapes, leavening (baking soda, sodium acid pyrophosphate, monocalcium phosphate), dried apples, citric acid, modified wheat starch, gelatin, yellow corn flour, natural and artificial flavor, xanthan gum, soy lecithin, caramel color, cornstarch, turmeric extract color, red 40, blue 2, blue 1, color added.",-0.727
Bread Artisan Sliced GF,8/12 OZ/CS,"ingredients: water, gluten free blend (corn starch, tapioca starch, modified tapioca starch, potato starch, sorghum flour, white rice flour, brown rice flour, amaranth flour), canola oil, sugar, psyllium, yeast, contains 2% or less of dried egg white, invert sugar, whole flax seeds, corn flakes, sunflower seeds, millet, pumpkin seeds, salt, cultured corn syrup solids, molasses powder, modified cellulose gum, cellulose gum, powdered cellulose, xanthan gum, enzymes, niacin, reduced iron, thiamine mononitrate, riboflavin, folic acid    contains: eggs  ",-0.727
Salad Pasta Greek Feta,2/5#/CS,"cooked enriched macaroni (semolina [wheat], enriched with niacin, ferrous sulfate, thiamin mononitrate, riboflavin, folic acid), cooked enriched spinach spirals (semolina [wheat], dried spinach, enriched with niacin, ferrous sulfate, thiamin mononitrate, riboflavin, folic acid), soybean oil, white distilled vinegar, water, red bell peppers, tomatoes, cucumbers, black olives (black olives, water, salt, ferrous gluconate), feta cheese ([pasteurized milk, cheese cultures, salt, enzymes], powdered cellulose [to prevent caking], natamyacin [to protect flavor]), pepperoncini peppers (peppers, water, vinegar, salt, sodium benzoate and sodium metabisulfite [as preservatives]), contains less than 2% of sugar, salt, green onions, spices, potassium sorbate (to retard spoilage), granulated garlic. ",-0.725
Mix Waffle Multi-Grain w/Buckwheat,5/3#/CS,"enriched wheat flour (wheat flour, niacin, reduced iron, thiamine mononitrate, riboflavin, folic acid), sugar, soybean  oil, leavenings (sodium bicarbonate, monocalcium phosphate, sodium aluminum phosphate), buckwheat flour,  buttermilk, contains 2% or less of the following: wheat bran, rice flour, yellow corn flour, whole oat flour, whey,  whole egg, salt, dextrose, wheat starch, natural and artificial flavor, malted barley extract, lactic acid.    ",-0.72
RP Poptart Strawberry Frosted Box 6/2PK,6/3.67 OZ/CS,"enriched flour (wheat flour, niacin, reduced iron, vitamin b1 [thiamin mononitrate], vitamin b2 [riboflavin], folic acid), corn syrup, high fructose corn syrup, dextrose, soybean and palm oil (with tbhq for freshness), sugar, bleached wheat flour.contains 2% or less of wheat starch, salt, dried strawberries, dried pears, dried apples, leavening (baking soda, sodium acid pyrophosphate, monocalcium phosphate), citric acid, gelatin, modified wheat starch, yellow corn flour, caramel color, xanthan gum, cornstarch, turmeric extract color, soy lecithin, red 40, yellow 6, blue 1, color added.",-0.719
Bread Flat Naan Stone Baked FZ,8/6CT/CS,"enriched wheat flour (wheat flour, niacin, reduced iron, ascorbic acid added as dough conditioner, thiamine mononitrate, riboflavin, enzyme, folic acid) water, soybean and / or canola oil, buttermilk (skim milk, dry buttermilk, bacterial culture), cultured wheat flour, sugar, baking powder (sodium acid pyrophosphate, sodium bicarbonate, cornstarch, monocalcium phosphate), sea salt, wheat gluten, dextrose, dextrin, vegetable fiber, salt, ghee (clarified butter), salt, inactive yeast, yeast. ",-0.714
Artichoke Hearts Marinated,6/67 OZ/CS,"artichoke hearts, water, sunflower oil, cane vinegar, salt, spices, citric acid.",-0.714
RP Candy Twizzler Strawberry Bites 8 OZ,1/8 OZ/CS,"corn syrup, enriched wheat flour (flour, niacin, ferrous sulfate, thiamin mononitrate, riboflavin, folic acid), sugar, less than 2% of: palm oil, natural flavor, artificial flavor, cornstarch, glyceryl monostearate, pectin, ctiric acid, salt, glycerin, sodium citrat,e artificial color (red 40), mineral oil, carnauba wax ",-0.714
"Pie Shell Raw 6"" FZ",12/6CT/CS,"wheat flour (unenriched, unbleached), vegetable shortening (interesterified soybean oil), water, salt, dextrose, baking soda",-0.714
Crackers Oyster Individual ,150/.5 OZ/CS,"unbleached wheat flour, water, canola oil, all natural evaporated cane juice, salt, yeast, baking soda. ",-0.714
RP Shake Prairie Farms Frosted CnC,1/10 OZ/CS,"milkfat and nonfat milk, corn syrup, sugar, cookies (sugar, enriched flour [wheat flour, niacin, reduced iron, thiamine mononitrate, and riboflavin], vegetable shortening [contains one or more of the following partially hydrogenated oils: soybean, cottonseed], dextrose, caramel color, high fructose corn syrup, cocoa [processed with alkali], cornstarch, corn flour, whey, sodium bicarbonate, ammonium bicarbonate, salt, artificial flavor, red #40, blue #1, soy lecithin), high fructose corn syrup, whey, stabilized and emulsified by mono and diglycerides, guar gum, cellulose gum and carrageenan, artificial flavor and vegetable annatto color",-0.71
RP Poptart Cherry Frosted Box 6/2PK,6/2 OZ/CS,"enriched flour (wheat flour, niacin, reduced iron, vitamin b1 [thiamin mononitrate], vitamin b2 [riboflavin], folic acid), corn syrup, high fructose corn syrup, dextrose, soybean and palm oil (with tbhq for freshness), sugar, bleached wheat flour.contains 2% or less of wheat starch, salt, dried cherries, dried apples, citric acid, leavening (baking soda, sodium acid pyrophosphate, monocalcium phosphate), modified wheat starch, gelatin, caramel color, xanthan gum, soy lecithin, red 40, natural flavor, red 40 lake, yellow 6, carnauba wax, confectioner's glaze, blue 1.",-0.71
RP Cookie Mother's Animal Crackers Frost,6/3 OZ/CS,"sugar, enriched flour (wheat flour, niacin, reduced iron, vit b1, vit b2, folic acid), hydrogenated palm kernel oil, nonfat milk, cornstarch. contains 2% or less of high fructose corn syrup, salt, soy lecithin, artificial flavors, baking soda, confectioners glaze, carnauba wax, color added, red 3, red 40 lake, yello 5, blue 1, blue 2 lake, yellow 6 lake, yellow 6",-0.708
RP Bagel Bites Three Cheese 7 OZ FZ,8/7 OZ/CS,"bagel halves (enriched flour [wheat flour, enzyme, ascorbic acid, niacin, reduced iron, thiamine mononitrate, riboflavin, folic acid], water, salt, invert cane syrup, yeast, soybean oil), topping (cheese blend [(cheese [mozzarella cheese (cultured milk, salt, enzymes), modified food starch, nonfat milk, whey protein concentrate]), cheddar cheese (cultured milk, salt, enzymes, annatto color), monterey jack cheese (cultured milk, salt, enzymes)]), sauce (water, tomato paste, invert cane syrup, modified food starch, salt, methyl cellulose, citric acid, potassium chloride, ammonium chloride, spice, yeast extract, natural flavor, calcium lactate), invert cane syrup,  ",-0.707
RP Bagel Bites Single 3 Cheese 7 OZ FZ,7 OZ/CS,"bagel halves (enriched flour [wheat flour, enzyme, ascorbic acid, niacin, reduced iron, thiamine mononitrate, riboflavin, folic acid], water, salt, invert cane syrup, yeast, soybean oil), topping (cheese blend [(cheese [mozzarella cheese (cultured milk, salt, enzymes), modified food starch, nonfat milk, whey protein concentrate]), cheddar cheese (cultured milk, salt, enzymes, annatto color), monterey jack cheese (cultured milk, salt, enzymes)]), sauce (water, tomato paste, invert cane syrup, modified food starch, salt, methyl cellulose, citric acid, potassium chloride, ammonium chloride, spice, yeast extract, natural flavor, calcium lactate), invert cane syrup,  ",-0.707
RP Cereal Corn Pops Cup,6/1.5 OZ/CS,"milled corn, sugar, corn syrup, contains 2% or less of molasses, salt, vegetable oil (hydrogenated coconut, soybean and/or cottonseed), mixed tocopherols, annatto extract, color, wheat starch. vitamins/minerals (niacinamide, vitamin b6, vitamin b2, vitamin b1, folic acid, vitamin d3, vitamin b12)",-0.706
Cod Fillet Tavern Battered Raw IQF,10#/CS,"cod, enriched bleached wheat  flour (flour, niacin, reduced iron, thiamine mononitrate, riboflavin, folic acid), water, cottonseet and/or soybean oil, and contains less than 2% of: modified corn starch, salt, garlic powder, whey, leavening (sodium acid pyrophosphate, sodium bicarbonate, corn starch, monocalcium phosphate), rice flour, caramel color, corn syrup, spices, natural flavor, xanthan gum, sugar, maltodextrin, artificial color (including fd&c yellow 5 [tartazine], fd&c yellow 6 [sunset yellow]. ",-0.704
RP Cookie Belvita Cinnamon Brown Sugar,8/1.76 OZ/ CS,"whole grain blend (rolled oats, rye flakes), enriched flour [wheat flour, niacin, reduced iron, thiamin mononitrate (vitamin b1), riboflavin (b2), folic acid], canola oil, whole grain wheat flour, sugar brown sugar, malt syrup (from corn and barley), invert sugar, baking soda, salt, soy lecithin, disodium pyrophosphate, cinnamon, datem , natural flavor, ferric orthophosphate (iron), niacinamide, molasses, pyridoxine, hydrocholride (vitamin b6), riboflavin (vitamin b2), thiamin mononitrate (vitamin b1)",-0.704
Mix Muffin ,6/5#/CS,"enriched bleached flour (wheat flour, malted barley flour, niacin, reduced iron, thiamin mononitrate, riboflavin, folic acid), sugar, palm and soybean oil, dextrose, less than 2% of: artificial flavor, baking soda, eggs, mono & diglycerides, monocalcium phosphate, nonfat milk, propylene glycol monoester, salt, sodium aluminum phosphate, sodium stearoyl lactylate, soy lecithin, wheat protein isolate, wheat starch, whey (milk protein). common allergens present: wheat, milk, egg, soy. ",-0.704
DST Muffin Batter Apple Cinnamon FZ,18#/CS,"enriched flour bleached (wheat flour, niacin, iron, thiamin mononitrate, riboflavin, folic acid), water, sugar, soybean oil, apples, corn syrup solids, eggs, dried sour cream (cream, skim milk, cultures), modified tapioca starch, cinnamon, baking soda, salt, maltodextrin, preserved with (ascorbic acid, citric acid), dextrose, modified corn starch, spices, natural flavor, xanthan gum.",-0.704
RP Sauce Marinara Cup,84/2.5 OZ/CS,"tomato puree, diced tomatoes, sugar, soybean oil, salt, dried garlic, dried onions, spices, parsley, citric acid. ",-0.7
RP WP Salad Tuna Bean/Corn Case,12/ 5 OZ/CS,"skipjack tuna (katsuwonus pelamis), organic red beans, organic sweetcorn, organic sunflower oil, organic red peppers, organic carrots, organic white wine vinegar, water, salt, natural chili flavor and ground black pepper",-0.7
RP Dip Sabra Hummus Roasted Garlic,12/4.56 OZ/CS,"cooked chickpeas, water, tahini (ground sesame), nongmo soybean oil, garlic, salt, nongmo citric acid, red bell pepper, potassium sorbate added to maintain freshness, spices.",-0.7
RP Dip Sabra Hummus Roasted Red Pepr,12/4.56 OZ/CS,"cooked chickpeas, water, tahini (ground sesame), nongmo soybean oil, red bell pepper, garlic, salt ,nongmo citric acid, potassium sorbate added to maintain freshness, natural flavors",-0.7
RP Bar Nick's Choc Peanut Keto,12/1.76 OZ/CS,"protein blend (milk protein concentrate, hydrolyzed collagen, calcium caseinate, whey protein concentrate, hydrolyzed whey protein, egg white), roasted peanuts, soluble corn fiber, vegetable glycerin, cocoa butter, erythritol, dry whole milk, water, xylitol, nonfat milk powder, unsweetened chocolate, chicory root fiber, sorbitol, butter (from sweet cream), coconut oil, shea nut oil, salt, sunflower lecithin, natural flavors, steviol glycosides. contains: milk, egg, peanuts, soy, coconut, shea nut.    may contain traces of sesame and other tree nuts.",-0.7
RP Poptart S'mores Box 6/2PK,6/3.67 OZ/CS,"enriched flour (wheat flour, niacin, reduced iron, vitamin b1 [thiamin mononitrate], vitamin b2 [riboflavin], folic acid), sugar, high fructose corn syrup, dextrose, soybean and palm oil (with tbhq for freshness), corn syrup, whole wheat flour, bleached wheat flour, whey.contains 2% or less of molasses, cocoa processed with alkali, cornstarch, leavening (baking soda, sodium aluminum phosphate), milk chocolate (sugar, milk, cocoa butter, chocolate), salt, modified corn starch, natural and artificial flavors, soy lecithin, gelatin, egg whites, color added, xanthan gum.",-0.7
RP Bar Quest Birthday Cake,12/2.12 OZ/CS,"protein blend(milk protein isolate, whey protein isolate), polydextrose (prebiotic fiber), water, erythritol, almond, palm kernel oil, glycerin, sodium caseinate, natural flavors, contains less than 2% of the following: sea salt, gum arabic, spirulina extract(color), red cabbage extract (color), tumeric extract(color), radish extract (color), sucralose, lecithin (sunflower and/or soy lecithin). contains milk, almonds, soy. ",-0.7
Sauce Tomato Marinara Smooth,6/10#/CS,"vine ripened diced tomatoes, tomato puree, carrot puree, extra virgin olive oil, sugar, garlic puree, dehydrated onion, sea salt, citric acid, spices.",-0.7
Donuts Specialty Premium Dozen,12 CT/CS,"enriched wheat flour bleached (flour, niacin, iron, thiamine mononitrate, riboflavin, folic acid, dextrose, soybean oil, contains 2% or less of: beta-carotene (color), defatted soy flour, eggs, enzymes, leavening (baking soda, sodium acid pyrophosphate), mono- and diglycerides, nonfat milk, salt, sodium stearoyl, lactylate, whey    contains: egg, milk, soy, wheat",-0.696
Donut Holes Specialty Premium Dozen,Dozen,"enriched wheat flour bleached (flour, niacin, iron, thiamine mononitrate, riboflavin, folic acid, dextrose, soybean oil, contains 2% or less of: beta-carotene (color), defatted soy flour, eggs, enzymes, leavening (baking soda, sodium acid pyrophosphate), mono- and diglycerides, nonfat milk, salt, sodium stearoyl, lactylate, whey    contains: egg, milk, soy, wheat",-0.696
Snack Mix Trail Nuts & Choco Planter,72/2 OZ/CS,"peanuts, raisins, almonds, chocolate covered peanuts (milk chocolate [sugar, cocoa butter, milk, chocolate, lactose, soy lecithin - an emulsifier, vanillin - an artificial flavor], peanuts, sugar, artificial color [includes red 40 lake], corn oil, corn syrup, gum arabic, confectioners glaze, carnauba wax, beeswax), chocolate candy covered raisins (milk chocolate [sugar, cocoa butter, milk, chocolate, lactose, soy lecithin - an emulsifier, vanillin - an artificial flavor], raisins, artificial color [includes blue 2 lake, red 40 lake, yellow 6 lake, yellow 5 lake], corn syrup, gum arabic, confectioners glaze, carnauba wax, beeswax), sugar, dried cranberries, cottonseed oil.",-0.692
RP Candy Awake Chocolate PB Bite,50 CT/CS,"milk chocolate (sugar, cocoa butter, chocolate liquor, whole milk powder, soy lecithin (added as an emulsifier), natural vanilla extract), peanut butter filling (dry roasted peanut, sucrose, palm oil, sea salt), hydrogenated palm kernel oil and soy lecithin, caffeine, soybean oil.",-0.692
AP Onion Rings Battered FZ,6/2.5#/CS,"onions, bleached enriched wheat flour (wheat flour, niacin, ferrous sulfate, thiamine mononitrate, riboflavin, folic acid), water, vegetable oil (soybean and/or canola oil), yellow corn flour, bleached wheat flour. contains 2% or less of blue 1, calcium caseinate, dextrose, leavening (sodium acid pyrophosphate, sodium bicarbonate), mono- and diglycerides, natural flavors, oleoresin paprika (color), potato starch, red 40, salt, sodium alginate, spices, sugar, whey, yellow 5.",-0.692
Mix Cake White Bakers Request ,1/50#/CS,"sugar, enriched wheat flour bleached (flour, niacin, iron, thiamine mononitrate, riboflavin, folic acid), egg whites, soybean oil, propylane glycol mono- and diesters of fatty acids, leavening (baking soda, sodium acid pyrophosphate, sodium aluminium phosphate, monocalcium phosphate, aluminum sulfate) contains 2% or less of: cellulose gum, dextrose, egg yolks, food starch-modified, mono- and diglycerides, natural and artifical flavor, nonfat milk, polysorbate 60, salt, sorbitan monostearate, soy lechitin, xanthan gum",-0.692
RP Bar Kind Carm Almd 1.4 Oz,12/1.4 Oz/CS,"almonds, chicory root fiber, honey, glucose syrup, palm kernel oil, sugar, rice flour, milk powder, sea salt, carob powder, soy lecthin, natural flavor, annatto.",-0.692
AP Cauliflower Battered FZ,6/2#/CS,"cauliflower, enriched bleached wheat flour (wheat flour, niacin, ferrous sulfate, thiamine mononitrate, riboflavin, folic acid), water, vegetable oil (soybean and/or canola), bleached wheat flour, yellow corn flour. contains 2% or less of blue 1, calcium caseinate, dextrose, leavening (sodium acid pyrophosphate, sodium bicarbonate), mono & diglycerides, natural flavors, oleoresin paprika (color), potato starch, red 40, salt, sodium alginate, spices, sugar, whey, yellow 5. ",-0.692
Soup Chicken Chili White,2/8#/CS,"great northern beans (beans, water, salt, calcium chloride), water, cooked white meat chicken (white meat chicken, water, potassium lactate, sodium tripolyphosphate, salt), chile peppers (green chiles, water, salt, citric acid, calcium chloride), onions, roastedpoblano peppers, chicken flavored seasoning (salt, dextrose, beef fat, maltodextrin, canola oil, chicken fat, corn starch, natural flavoring [inculding onion], chicken, hydrolyzed soy protein, disodium inosinate/disodium guanylate, turmeric, parsley), contains less than 2% of canola oil, cultured dextrose, chili powder (chili pepper, spices, salt, dehydrated garlic), jalapeno peppers, spices, salt.common allergens present: soy",-0.692
Bun Pretzel Bite .35OZ,4/2#/CS,"enriched flour (wheat flour, malted barley flour, niacin, reduced iron, thiamine mononitrate, riboflavin, folic acid), water, canola oil, sugar, contains 2% or less of the following: yeast, malted barley, salt, wheat flour, dextrose, sodium hydroxide, maltodextrin, cultured dextrose, wheat starch, malt, vegetable protein, sodium hydroxide, wheat starch, ascorbic acid, enzymes, microcrystalline cellulose ",-0.692
RP Cookie Belvita Blueberry,8/1.76 OZ/ CS,"whole grain blend (rolled oats, rye flakes), enriched flour [wheat flour, niacin, reduced iron, thiamin mononitrate (vitamin b1), riboflavin (vitamin b2), folic acid], canola oil, sugar, whole grain wheat flour, evaporated cane sugar, dried blueberries, malt syrup (from corn and barley), invert sugar, baking soda, salt, soy lecithin, disodium pyrophosphate, natural flavor, datem, blueberry juice concentrate, ferric orthophosphate (iron), niacinamide, pyridoxine hydrochloride (vitamin b6),",-0.692
AP Onions Battered FZ,9/2.5#/CS,"onions, enriched bleached wheat flour (wheat flour, niacin, ferrous sulfate, thiamine mononitrate, riboflavin, folic acid), water, vegetable oil (soybean and/or canola), yellow corn flour, bleached wheat flour. contains 2% or less of blue 1, calcium caseinate, dextrose, leavening (sodium acid pyrophosphate, sodium bicarbonate), mono- & diglycerides, natural flavors, oleoresin paprika (color), potato starch, red 40, salt, sodium alginate, spices, sugar, whey, yellow 5.",-0.692
BD Sourdough MI Bread Company,6/27 OZ/CS," enriched wheat flour (wheat flour, malted barley   flour, niacin, reduced iron, thiamin mononitrate, riboflavin, folic acid),   water, soybean oil, yeast, natural sour (wheat flour, sourdough (rye   flour, starter cultures, acetic acid), salt, sodium stearoyl lactylate,   fumaric acid, wheat gluten, datem, sunflower lecithin, enzymes,   ascorbic acid), vital wheat gluten, calcium propionate (preservative)   contains: wheat  manufactured in a faciltiy that uses wheat,egg, milk and sesame",-0.692
RP Bar Nature Valley Protein PB DarkChoc,16/1.42 OZ/CS,"roasted peanuts, soy protein isolate, chicory root extract, semisweet chocolate chips (sugar, chocolate liquor, cocoa butter, soy lecithin, natural flavor), vegetable oils (palm, palm kernel, canola, peanut), sugar, corn syrup, whey protein concentrate, fructose, peanut butter (peanuts, salt), cocoa, vegetable glycerin, rice starch, soy lecithin, salt, corn starch, natural flavor.    contains: peanut, soy and milk",-0.692
"Pie Pumpkin Baked 8""","10/8""/CS","shelf stable pumpkin baked: pumpkin,milk(water and non-fat milk solids), sugar,whole eggs,evaporated milk,wheat flour,modified food starch,spices,salt,acidified calcium sulfate,potassium sorbate,sodium  propionate,sodium benzoate,and methylcellulose. crust contains: wheat flour(niacin,reduced iron,thiamin mononitrate,riboflavin,enzyme,folic acid),vegetable shortening(soybean oil,hydrogenated soybean oil, hydrogenated cottonseed oil),water,dextrose,salt,and calcium propionate.  ",-0.692
"DST Cake Yellow Round 8"" Un-Iced FZ",24 CT/CS,"sugar, enriched bleached wheat flour (flour, niacin, reduced iron, thiamine mononitrate, riboflavin, folic acid), egg whites, water, soybean oil, eggs, contains less than 2% of the following: wheat starch, leavening (sodium acid pyrophosphate, baking soda, monocalcium phosphate), propylene glycol mono and diesters of fats and fatty acids, whey (a milk derivative), salt, dextrose, mono and diglycerides, natural and artificial flavor (contains milk ingredients), sodium caseinate (a milk derivative), modified corn starch, guar gum, sodium stearoyl lactylate, polysorbate 60, xanthan gum, soy lecithin, artificial color (yellow lake 5).",-0.69
Blend Grain Exotic FZ,6/40 OZ/CS,"cooked red and brown rice,  cooked black beans, corn, cooked  red quinoa, tomatoes, red bell  pepper, roasted anaheim chili  pepper, onion, cooked amaranth,  vegetable oil (canola oil and/or  soybean oil), contains less than  2% of autolyzed yeast extract,  cane sugar, cilantro, garlic  powder, green and red bell  pepper powder, lime juice powder  (corn syrup solids, lime juice,  natural flavor), molasses  powder, mushroom powder, onion  powder, potassium chloride salt,  rice flour, roasted garlic,  roasted yellow bell pepper, salt,  sea salt, spices, tomato powder.",-0.69
DST Muffin Batter Choco Choco Chip FZ,6/3 #/CS,"water, sugar, enriched flour bleached (wheat flour, malted barley flour, niacin, iron, thiamin mononitrate, riboflavin, folic acid), soybean oil, semisweet chocolate chips (sugar, chocolate liquor, cocoa butter, soy lecithin, natural flavor), cocoa processed with alkali, eggs, modified corn starch, baking soda, salt, sodium aluminum phosphate, distilled monoglycerides, preserved with (potassium sorbate, mixed tocopherols, citric acid, ascorbic acid), xanthan gum, natural flavor.      contains wheat, egg and soy; may contain milk ingredients.",-0.69
Ice Cream PF White Mint 48oz FZ,4/48 OZ/CS,"cream, milk, sugar, skim milk, chocolate chunks (sugar, coconut oil, cocoa (processed with alkali), cocoa, soy lecithin, natural flavors, milk), whey, stabilizer (mono and diglycerides, guar gum, cellulose gum and carrageenan), natural flavor",-0.688
RP Candy Snickers Almond,24/1.83 OZ/CS,"milk chocolate (sugar, cocoa butter, chocolate, skim milk, lactose, milkfat, soy lecithin), corn syrup, almonds, sugar, skim milk, palm oil, less than 2 % - lactose, salt, hydrogenated palm kernel oil, egg whites, artificial flavor.    contains almonds, milk, egg and soy. may contain other tree nuts and peanuts.",-0.684
RP Candy Snickers Almond KS,24/3.32 OZ/CS,"milk chocolate (sugar, cocoa butter, chocolate, skim milk, lactose, milkfat, soy lecithin), corn syrup, almonds, sugar, skim milk, palm oil, less than 2 % - lactose, salt, hydrogenated palm kernel oil, egg whites, artificial flavor.    contains almonds, milk, egg and soy. may contain other tree nuts and peanuts.",-0.684
Mix Cake Yellow,6/5#/CS,"sugar, enriched flour bleached (wheat flour, niacin, iron, thiamin mononitrate, riboflavin, folic acid), palm oil, dextrose. contains 2 % or less of: leavening (sodium aluminum phosphate, baking soda), propylene glycol mono and diesters of fatty acids, modified corn starch, egg with sodium silicoaluminate, egg white, salt, nonfat milk, mono and diglycerides, modified whey, xanthan gum, natural flavor, annatto and turmeric extract color, defatted soy flour     ",-0.682
